19:36:35.459386 IP ip-172-18-0-5.ec2.internal.43856 > ip-172-30-0-2.ec2.internal.domain: 9208+ AAAA? info.cern.ch. (30)
19:36:35.459431 IP ip-172-18-0-5.ec2.internal.50446 > ip-172-30-0-2.ec2.internal.domain: 24795+ A? info.cern.ch. (30)
19:36:35.459752 IP ip-172-30-0-2.ec2.internal.domain > ip-172-18-0-5.ec2.internal.50446: 24795 2/0/0 CNAME webafs624.cern.ch., A 188.184.64.53 (70)
19:36:35.459758 IP ip-172-30-0-2.ec2.internal.domain > ip-172-18-0-5.ec2.internal.43856: 9208 2/0/0 CNAME webafs624.cern.ch., AAAA 2001:1458:201:a4::100:2f (82)
19:36:35.459862 IP 127.0.0.11.domain > localhost.45152: 9208 2/0/0 CNAME webafs624.cern.ch., AAAA 2001:1458:201:a4::100:2f (82)
19:36:35.459918 IP 127.0.0.11.domain > localhost.45152: 24795 2/0/0 CNAME webafs624.cern.ch., A 188.184.64.53 (70)
19:36:36.439916 IP ip-172-18-0-5.ec2.internal.49864 > ip-172-30-0-2.ec2.internal.domain: 23865+ PTR? 2.0.30.172.in-addr.arpa. (41)
19:36:36.441402 IP ip-172-30-0-2.ec2.internal.domain > ip-172-18-0-5.ec2.internal.49864: 23865 1/0/0 PTR ip-172-30-0-2.ec2.internal. (81)
19:36:36.441473 IP 127.0.0.11.domain > localhost.53897: 23865 1/0/0 PTR ip-172-30-0-2.ec2.internal. (81)
19:36:36.441749 IP ip-172-18-0-5.ec2.internal.42449 > ip-172-30-0-2.ec2.internal.domain: 60585+ PTR? 5.0.18.172.in-addr.arpa. (41)
19:36:36.442502 IP ip-172-30-0-2.ec2.internal.domain > ip-172-18-0-5.ec2.internal.42449: 60585 1/0/0 PTR ip-172-18-0-5.ec2.internal. (81)
19:36:36.442567 IP 127.0.0.11.domain > localhost.48290: 60585 1/0/0 PTR ip-172-18-0-5.ec2.internal. (81)
19:36:36.442885 IP ip-172-18-0-5.ec2.internal.47297 > ip-172-30-0-2.ec2.internal.domain: 24701+ PTR? 11.0.0.127.in-addr.arpa. (41)
19:36:36.443114 IP ip-172-30-0-2.ec2.internal.domain > ip-172-18-0-5.ec2.internal.47297: 24701 NXDomain* 0/1/0 (91)
19:36:36.443167 IP 127.0.0.11.domain > localhost.32885: 24701 NXDomain* 0/1/0 (91)
19:36:48.858375 IP ip-172-18-0-5.ec2.internal.54628 > ip-172-30-0-2.ec2.internal.domain: 63611+ A? info.cern.ch. (30)
19:36:48.858461 IP ip-172-18-0-5.ec2.internal.50399 > ip-172-30-0-2.ec2.internal.domain: 16165+ AAAA? info.cern.ch. (30)
19:36:48.858734 IP ip-172-30-0-2.ec2.internal.domain > ip-172-18-0-5.ec2.internal.54628: 63611 2/0/0 CNAME webafs624.cern.ch., A 188.184.64.53 (70)
19:36:48.858811 IP 127.0.0.11.domain > localhost.40465: 63611 2/0/0 CNAME webafs624.cern.ch., A 188.184.64.53 (70)
19:36:48.858836 IP ip-172-30-0-2.ec2.internal.domain > ip-172-18-0-5.ec2.internal.50399: 16165 2/0/0 CNAME webafs624.cern.ch., AAAA 2001:1458:201:a4::100:2f (82)
19:36:48.858905 IP 127.0.0.11.domain > localhost.40465: 16165 2/0/0 CNAME webafs624.cern.ch., AAAA 2001:1458:201:a4::100:2f (82)

